{
  "authority_references": [
    {
      "artifact_id": "phase5e:shared_scheduling_model",
      "authority_tier": "tier_1",
      "classification_status": "include",
      "permitted_use": "Shared renewal, rate-trajectory, serial-dependence, packet-boundary, and deterministic-seed semantics.",
      "source_field": "timing_contract|packet_contract",
      "source_scope": "shared_scheduler_contract"
    },
    {
      "artifact_id": "phase4d_f:session_1_profile",
      "authority_tier": "tier_1",
      "classification_status": "include",
      "permitted_use": "Direct Session 1 descriptive timing and packet-profile fields without refitting or treating them as a universal script.",
      "source_field": "timing|packet",
      "source_scope": "direct_session_1"
    },
    {
      "artifact_id": "phase5e_hum_throb_contract",
      "authority_tier": "tier_1",
      "classification_status": "include",
      "permitted_use": "Coordinated timing, duration, density, gain, and overlap interpretation; timing plus duration is strongest.",
      "source_field": "coordinated_dimensions|strongest_supported_diagnostic",
      "source_scope": "shared_hum_throb_contract"
    },
    {
      "artifact_id": "phase5l_unit_grammar_audit_report",
      "authority_tier": "tier_2",
      "classification_status": "include",
      "permitted_use": "Parent authority for hash-inventoried audit-only training and validation event tables used by the Phase 5L packet grammar audit.",
      "source_field": "training/validation event metadata and generated-file inventory",
      "source_scope": "direct_session_1_and_baseline_sessions_1_4"
    },
    {
      "artifact_id": "phase5l_hum_putput_unit_interpretation",
      "authority_tier": "tier_2",
      "classification_status": "include",
      "permitted_use": "Cautious structural interpretation of clean stepped runs, continuations, skips, reversals, and short bursts.",
      "source_field": "candidate_evidence|summary",
      "source_scope": "baseline_sessions_1_4"
    },
    {
      "artifact_id": "phase5l_mode_specific_unit_grammar_profiles",
      "authority_tier": "tier_2",
      "classification_status": "include",
      "permitted_use": "Baseline continuation texture, motif repetition, and descriptive grammar guidance.",
      "source_field": "profiles.baseline_stochastic_texture",
      "source_scope": "baseline_sessions_1_4"
    },
    {
      "artifact_id": "x_alpha_closure:data/pulse_pattern_analysis.json",
      "authority_tier": "tier_2",
      "classification_status": "include",
      "permitted_use": "Session 1 and Baseline packet-cycle, continuation-count, and continuation-spacing distributions.",
      "source_field": "by_session.1|by_mode.Baseline Mode",
      "source_scope": "direct_session_1_and_baseline_aggregate"
    },
    {
      "artifact_id": "x_alpha_closure:data/macro_density_analysis.json",
      "authority_tier": "tier_2",
      "classification_status": "include",
      "permitted_use": "Mode-architecture distinction and Complex-only plateau/gap reference; not Baseline cluster targets.",
      "source_field": "recommendation.standard_modes|authoritative_event_density",
      "source_scope": "mode_architecture"
    },
    {
      "artifact_id": "x_alpha_closure:data/carrier_frequency_analysis.json",
      "authority_tier": "tier_2",
      "classification_status": "include",
      "permitted_use": "Terminology boundary: schedule spectra do not establish a continuous carrier.",
      "source_field": "source_low_frequency_schedule_spectrum",
      "source_scope": "source_schedule_spectrum"
    },
    {
      "artifact_id": "x_alpha_closure:methods/measurement_methods.md",
      "authority_tier": "tier_1",
      "classification_status": "include",
      "permitted_use": "Reproducible packet, density, and schedule-spectrum measurement semantics.",
      "source_field": "measurement_methods",
      "source_scope": "reproducibility_method"
    }
  ],
  "authorization_blockers": [],
  "between_cluster_gap_model": {
    "authority_tier": "tier_2",
    "definition": "The onset gap from the final packet start of one merged phrase-active cluster to the first packet start of the next cluster in the same source block.",
    "source_scope": "direct_session_1_validation",
    "status": "advisory",
    "target_quantiles_seconds": {
      "maximum": 4.514125,
      "median": 0.7834687499999999,
      "minimum": 0.42310416666666667,
      "p10": 0.44219375,
      "p90": 2.206200000000001
    }
  },
  "blocked_interpretations": [
    "continuous_carrier_without_direct_permitted_evidence",
    "schedule_spectrum_as_carrier_frequency",
    "complex_mode_deep_gates_as_baseline_requirements",
    "global_fixed_packet_lattice",
    "exact_source_sequence_replay",
    "canonical_packet_grammar_replacement",
    "macro_unit_only_generation",
    "motif_waveform_transformation",
    "motif_time_scaling",
    "calibration_or_normalization_change"
  ],
  "channel_coupling_rules": {
    "authority_tier": "tier_1",
    "definition": "Phrasing may coordinate packet selection and channel transitions only through canonical grammar and remappable Focus Role semantics. It may not hard-code a physical focus channel.",
    "preserve_canonical_packet_grammar": true,
    "preserve_focus_role_bundle": true,
    "source_scope": "shared_grammar_and_role_contract",
    "status": "binding"
  },
  "cluster_detection": {
    "authority_tier": "tier_2",
    "definition": "A phrase-active window contains four packet starts and the three exact sample-aligned inter-packet intervals between them. A validation window is phrase-active when its interval triple occurred in the training population. Overlapping or adjacent active windows are merged into one non-overlapping meso cluster.",
    "minimum_packets": 4,
    "model_type": "probabilistic_recurrent_interval_phrase_state",
    "prohibited_threshold_reuse": {
      "reason": "The source field defines provisional same-channel packet trains, not gaps between canonical packet starts.",
      "session_1_source_packet_threshold_samples": 12376
    },
    "runtime_rule": "WGE-5B uses aggregate state transitions and distribution targets; it must not embed or replay the source phrase dictionary.",
    "source_scope": "direct_session_1_training_to_validation",
    "status": "advisory",
    "threshold_samples": null
  },
  "cluster_duration_model": {
    "authority_tier": "tier_2",
    "definition": "The onset span from the first through final packet start in a merged phrase-active cluster.",
    "source_scope": "direct_session_1_validation",
    "status": "advisory",
    "target_quantiles_seconds": {
      "maximum": 19.045833333333334,
      "median": 1.58203125,
      "minimum": 0.6879166666666666,
      "p10": 0.82128125,
      "p90": 4.667639583333333
    }
  },
  "cluster_size_distribution": {
    "authority_tier": "tier_2",
    "definition": "Packet starts covered by each merged phrase-active cluster.",
    "source_scope": "direct_session_1_validation",
    "status": "advisory",
    "target_quantiles_packets": {
      "maximum": 68,
      "median": 6,
      "minimum": 4,
      "p10": 4,
      "p90": 17.4
    }
  },
  "content_hash": "6297addcf7129b177f11c9fae23e3ae4a85f20ae6fa83d1c392d291608699e32",
  "density_state_linkage": {
    "authority_tier": "tier_2",
    "baseline_rule": "Permit local stochastic density modulation using the recurrent phrase state. Direct Session 1 validation has phrase-cluster onset-span occupancy 0.704542 and quiet-gap onset-span occupancy 0.252784; these are advisory observations, not exact runtime quotas.",
    "complex_mode_rule": "Complex macro states remain a separate architecture and are not imported into Baseline.",
    "definition": "Meso phrasing may modulate local packet rate and selection within Baseline while remaining distinct from Complex Mode macro gating.",
    "source_scope": "direct_session_1_validation_and_mode_architecture",
    "status": "advisory"
  },
  "engine_version": "0.5.1",
  "executable": false,
  "future_acceptance_gates": [
    {
      "metric_id": "canonical_packet_grammar_preserved",
      "requirement": "Every realised packet continues to pass existing grammar structure validation.",
      "source_scope": "tier_1_grammar_contract",
      "status": "binding"
    },
    {
      "metric_id": "deterministic_seed_reproduction",
      "requirement": "Same profile, duration, and seed produce byte-identical plans and cluster annotations.",
      "source_scope": "shared_scheduler_contract",
      "status": "binding"
    },
    {
      "metric_id": "holdout_seed_robustness",
      "requirement": "Primary and at least two holdout seeds pass structural gates and source comparisons; exact cross-seed equality is forbidden.",
      "source_scope": "engine_validation",
      "status": "binding"
    },
    {
      "metric_id": "no_global_fixed_lattice",
      "requirement": "Packet intervals retain non-zero variance and no phrase category creates a session-wide fixed cadence.",
      "source_scope": "shared_scheduler_contract",
      "status": "binding"
    },
    {
      "metric_id": "no_continuous_carrier",
      "requirement": "No oscillator or carrier control is introduced; schedule periodicity remains neutrally labelled.",
      "source_scope": "carrier_policy",
      "status": "binding"
    },
    {
      "metric_id": "cluster_count_per_minute",
      "requirement": "Compare against direct Session 1 validation 15.3888 clusters per observed minute and its 8.1029-22.3675 per-block empirical band; report Baseline separately.",
      "source_scope": "direct_session_1_validation",
      "status": "advisory"
    },
    {
      "metric_id": "cluster_size_quantiles",
      "requirement": "Generated packet-count quantiles must be compared with direct Session 1 validation p10/p50/p90 of 4/6/17.4 and the observed block ranges.",
      "source_scope": "direct_session_1_validation",
      "status": "advisory"
    },
    {